GRAND THEFT AUTO: CHINATOWN WARS;93;8.3;DS;Rockstar Games;Rockstar Leeds;Mar 17, 2009;Grand Theft Auto: Chinatown Wars is an entirely original entry into the critically acclaimed Grand Theft Auto series, and brings a new level of interactivity to its sprawling open environments. With the use of the DS touch screen, players navigate their way through the streets as they… Expand;85 ;Action Adventure,Modern,Modern,Open-World
FLIPNOTE STUDIO;93;7.5;DS;Nintendo;Nintendo;Aug 12, 2009;[DSiWare] Let your inner artist loose with Flipnote Studio, an easy to use and surprisingly powerful animation application. Create Flipnotes by using the stylus to write letters and draw pictures, capture sounds using the microphone, and even insert photos captured with the Nintendo DSi… Expand;7 ;Miscellaneous,General,Application
CHRONO TRIGGER;92;9.1;DS;Square Enix;TOSE;Nov 25, 2008;[Metacritic's 2008 DS Game of the Year] When a newly developed teleportation device malfunctions at the Millennial Fair, young Crono must travel through time to rescue his unfortunate companion from an intricate web of past and present perils. The swashbuckling adventure that ensues soon… Expand;57 ;Role-Playing,Console-style RPG,Console-style RPG,Japanese-Style
MARIO KART DS;91;8.7;DS;Nintendo;Nintendo;Nov 14, 2005;Race and battle with up to eight karts at once, regardless of whether or not everyone has a Game Card. The all–star cast includes Mario, Luigi, Peach, Yoshi, Donkey Kong, Wario, Bowser, and Toad. With courses drawn from every Mario Kart game - Super Mario Kart, Mario Kart 64, Mario Kart:… Expand;64 ;Driving,Racing,Arcade,Kart,Kart,Automobile
MARIO & LUIGI: BOWSER'S INSIDE STORY;90;8.8;DS;Nintendo;Alphadream Corporation;Sep 14, 2009;In his evil plot to take over the Mushroom Kingdom, Fawful tricks Bowser into eating a magic mushroom. The mushroom causes Bowser to begin inhaling everything around him, including Mario, Luigi and Princess Peach! Do the Mario Bros. have the guts to rescue Peach and escape? Players are in… Expand;58 ;Role-Playing,Action RPG,Console-style RPG,Console-style RPG,Japanese-Style
THE LEGEND OF ZELDA: PHANTOM HOURGLASS;90;7.9;DS;Nintendo;Nintendo;Oct 1, 2007;[Metacritic's 2007 DS Game of the Year] Many months have passed since the events of The Legend of Zelda: The Wind Waker, and Link, Tetra and Tetra’s band of pirates have set sail in search of new lands. They come across a patch of ocean covered in a dense fog, in which they discover an… Expand;57 ;Action Adventure,Fantasy,Fantasy,Open-World
ADVANCE WARS: DUAL STRIKE;90;8.9;DS;Nintendo;Intelligent Systems;Aug 22, 2005;Players lead their new Commanding Officers to fend off the Black Hole Army’s latest invasion. With massive battles that sweep across both of the DS screens, Advance Wars: Dual Strike will change the face of war forever. Use the top screen for quick-reference battle intel, or take control in… Expand;49 ;Strategy,Turn-Based,Modern,Modern,Tactics
CASTLEVANIA: DAWN OF SORROW;89;8.5;DS;Konami;Konami;Oct 4, 2005;The year is 2036, one year after the events of "Castlevania: Aria of Sorrow." Soma Cruz finds himself at the center of a mysterious cult's plan to resurrect their evil lord and master Dracula. In order to save himself and protect the lives of those he loves, Soma must infiltrate the enemy's… Expand;52 ;Action,Role-Playing,Platformer,Platformer,Action RPG,2D,2D
NEW SUPER MARIO BROS.;89;8.5;DS;Nintendo;Nintendo;May 15, 2006;The first new 2D Mario platformer since Super Mario World has arrived. Boasting "incredible" 3D graphics to accompany classic 2D gameplay, this fast-paced adventure will have Mario fans cheering as they make their way over fields, under water, through castles and into the air. New and… Expand;65 ;Action,Platformer,Platformer,2D,2D
METEOS;88;7.4;DS;Nintendo;Q Entertainment;Jun 28, 2005;"Rez" creator Tetsuya Mizuguchi brings us Meteos - a curious blend of block-dropping puzzle action with other gameplay elements with the goal to launch all of one's blocks into orbit.;49 ;Miscellaneous,Puzzle,Puzzle,Puzzle,Matching,Matching
THE WORLD ENDS WITH YOU;88;8.7;DS;Square Enix;Jupiter Corporation;Apr 22, 2008;The story begins as our hero, Neku, wakes up amidst the hustle and bustle of Shibuya, Tokyo. Confused and disoriented, he receives a message on his phone warning him that he will cease to exist unless he completes a certain mission. With his life seemingly on the line, Neku plunges into the… Expand;59 ;Role-Playing,Action RPG,Action RPG
POKEMON WHITE VERSION;87;7.7;DS;Nintendo;Game Freak;Mar 6, 2011;Pokémon Black Version and Pokémon White Version feature new Pokémon that players can catch, train and battle as they progress through the game, and some Pokémon can only be caught in one version of the game. For example, the Legendary Pokémon Reshiram can… Expand;56 ;Role-Playing,Console-style RPG,Console-style RPG,Trainer
DRAGON QUEST IX: SENTINELS OF THE STARRY SKIES;87;8.6;DS;Nintendo;Level 5;Jul 11, 2010;Developed by Level 5 (the developers of "Dragon Quest VIII," "Dark Cloud" and "Rogue Galaxy") Dragon Quest IX unites the key components that made the previous Dragon Quest titles such as success. Horii and Sugiyama are on board to provide their talents as DQIX takes the series in a decidedly… Expand;65 ;Role-Playing,Console-style RPG,Console-style RPG,Japanese-Style
POKEMON SOULSILVER VERSION;87;9.2;DS;Nintendo;Game Freak;Mar 14, 2010;Return to the beloved Johto region first introduced in the Pokémon Gold and Silver Version games for the portable Game Boy system. Several new enhancements for the series, such as updated graphics and touch screen features, enrich these timeless adventures, and the new Pokéwalker accessory… Expand;49 ;Role-Playing,Console-style RPG,Console-style RPG,Trainer
ELITE BEAT AGENTS;87;8.5;DS;Nintendo;iNiS;Nov 6, 2006;In a jam? Well, all these guys DO is jam! Prepare to rock as these beat masters use their groovy moves to save the day. As the music plays, players tap the screen, trace rhythmic patterns and keep the beat as the story unfolds on the top screen. Every scene is accompanied by rump-shaking… Expand;51 ;Action,Miscellaneous,Rhythm,Music,Music
THE LEGEND OF ZELDA: SPIRIT TRACKS;87;7.9;DS;Nintendo;Nintendo;Dec 7, 2009;The Legend of Zelda: Spirit Tracks sets hero Link on a daring new adventure. The game provides players with a new story, more puzzles and even a new mode of transportation. In this game, Link voyages by train, which offers up new possibilities for problem-solving. The game has the same look… Expand;75 ;Action Adventure,Fantasy,Fantasy,Open-World
POKEMON HEARTGOLD VERSION;87;9.1;DS;Nintendo;Game Freak;Mar 14, 2010;Return to the beloved Johto region first introduced in the Pokémon Gold and Silver Version games for the portable Game Boy system. Several new enhancements for the series, such as updated graphics and touch screen features, enrich these timeless adventures, and the new Pokéwalker accessory… Expand;59 ;Role-Playing,Console-style RPG,Console-style RPG,Trainer
POKEMON BLACK VERSION;87;7.7;DS;Nintendo;Game Freak;Mar 6, 2011;Pokémon Black Version and Pokémon White Version feature new Pokémon that players can catch, train and battle as they progress through the game, and some Pokémon can only be caught in one version of the game. For example, the Legendary Pokémon Reshiram can… Expand;63 ;Role-Playing,Console-style RPG,Console-style RPG,Trainer
KIRBY: CANVAS CURSE;86;7.8;DS;Nintendo;HAL Labs;Jun 13, 2005;(Also known as "Touch! Kirby's Magic Paintbrush") Kirby: Canvas Curse delivers classic Kirby action with a fun twist. Using the stylus to control Kirby's movements is surprisingly intuitive, and the new control scheme provides many unique gameplay challenges. The rainbow paths you draw… Expand;48 ;Action,Platformer,Platformer,2D,2D
MIGHT & MAGIC: CLASH OF HEROES;86;7.6;DS;Ubisoft;Capy Games;Dec 1, 2009;Might & Magic Clash of Heroes is the first puzzle adventure RPG game from Ubisoft.It is inspired by the famous Heroes brand and set in the Might & Magic universe. With a manga art direction it has been re-mastered into a glorious 2D environment. As a prequel to Heroes V, 40 years before,… Expand;39 ;Role-Playing,General,General
MARIO & LUIGI: PARTNERS IN TIME;86;8.5;DS;Nintendo;Alphadream Corporation;Nov 28, 2005;In this sequel to Mario & Luigi: Superstar Saga, the brothers travel back in time to retrieve Princess Peach, only to come face to face with baby versions of themselves, the princess and Bowser. Teaming up with their young selves will soon send Mario and Luigi on a quest of lunatic… Expand;45 ;Role-Playing,Console-style RPG,Console-style RPG,Japanese-Style
PLANET PUZZLE LEAGUE;86;7.8;DS;Nintendo;Intelligent Systems;Jun 4, 2007;(Also known as "Panel De Pon DS") Use the DS stylus to grab panels and slide them left and right. If you match three or more panels of the same color, they will vanish. Form chains and combos to create cascading waterfalls of panels to rack up high scores. The basic game play is similar to… Expand;25 ;Miscellaneous,Puzzle,Puzzle,General,Puzzle,General
ANIMAL CROSSING: WILD WORLD;86;8.6;DS;Nintendo;Nintendo;Dec 5, 2005;In this sequel to the wildly popular Nintendo GameCube game, players and up to three friends can hang out in the same village and interact in real time - either through wireless LAN or over Nintendo Wi-Fi Connection. Now players can visit a friend's village from thousands of miles away.… Expand;57 ;Simulation,Miscellaneous,Virtual Life,Virtual,Virtual Life
PROFESSOR LAYTON AND THE UNWOUND FUTURE;86;8.8;DS;Nintendo;Level 5;Sep 12, 2010;Professor Layton and his apprentice, Luke, receive a confounding letter - from Luke 10 years in the future. But the message inside is even more troubling: London of the future is in disarray, and the only personwho can help set things right is Professor Layton.;62 ;Miscellaneous,Puzzle,Puzzle,General,Puzzle,General
ADVANCE WARS: DAYS OF RUIN;86;8.7;DS;Nintendo;Intelligent Systems;Jan 21, 2008;(Also known as "Advance Wars: Dark Conflict" in the UK/EU) After a cataclysmic meteor strike exterminates 90% of the population, the survivors must battle barbarians, disease, and strongmen who seek only to secure their own power. Advance Wars has been reinvented. Set amidst a world in… Expand;55 ;Strategy,Turn-Based,Modern,Modern,Tactics
RADIANT HISTORIA;85;8.7;DS;Atlus;Atlus;Feb 22, 2011;In the midst of an unending war for dominance between two super-powers, Special Intelligence Agent Stocke is assigned to a routine escort mission that goes horribly awry.;30 ;Role-Playing,General,General,Japanese-Style
SHANTAE: RISKY'S REVENGE;85;7.7;DS;WayForward;WayForward;Oct 4, 2010;The sequel to the critically acclaimed Shantae is here!;15 ;Action,Platformer,Platformer,2D,2D
CASTLEVANIA: PORTRAIT OF RUIN;85;8.3;DS;Konami;Konami;Dec 5, 2006;Take control of two heroes, Jonathan Morris, a vampire killer and his close friend Charlotte Orlean, a girl with tremendous magical ability. Amidst the chaos of World War II, two mysterious sisters emerge, working to resurrect Dracula and David and Charlotte are all that stand in their way.… Expand;51 ;Action,Role-Playing,Platformer,Platformer,Action RPG,2D,2D
METROID PRIME: HUNTERS;85;7.9;DS;Nintendo;Nintendo;Mar 20, 2006;Who is the Galaxy's Most Elite Bounty Hunter? Before Metroid Prime Hunters, the answer was easy. Now that six other ferocious bounty hunters have gathered to challenge Samus, the title is up for grabs. Engage in intense four-player deathmatches either locally or against players from around… Expand;54 ;Action,Shooter,Shooter,First-Person,Sci-Fi,Sci-Fi,Arcade
POKEMON PEARL VERSION;85;8.2;DS;Nintendo;Game Freak;Apr 22, 2007;Pokemon Diamond and Pearl are traditional Pokemon RPGs that takes place in a region called Sinnoh. When you set off on your travels, you'll be able to play as either a boy or girl Trainer. Pokemon fans have caught glimpses of Lucario, Munchlax and Weavile in Pokemon movies, and these Pokemon… Expand;39 ;Role-Playing,Console-style RPG,Console-style RPG,Trainer
THE LEGEND OF ZELDA: FOUR SWORDS ANNIVERSARY EDITION;85;7.5;DS;Nintendo;GREZZO;Sep 28, 2011;The Legend of Zelda: Four Swords is a free DSiWare download.;13 ;Action Adventure,Fantasy,General,Fantasy
PROFESSOR LAYTON AND THE CURIOUS VILLAGE;85;8.4;DS;Nintendo;Level 5;Feb 10, 2008;(Also known as "Layton Kyouju no Fushigi na Machi" and "Professor Layton and the Mysterious Village") Marking Level 5's first foray onto the DS, Professor Layton is an old-fashioned point-and-click adventure which requires your use of skills such as reasoning, knowledge and creativity to… Expand;72 ;Miscellaneous,Adventure,Puzzle,Edutainment,General,Puzzle,General
SUPER MARIO 64 DS;85;8.3;DS;Nintendo;Nintendo;Nov 20, 2004;Super Mario 64, the genre-defining Nintendo 64 classic, arrives on the Nintendo DS with all-new features that take full advantage of the new portable system's dual screens, touch screen and wireless multiplayer capability. Play as Mario, Yoshi, Luigi and even Wario. You'll need to use each… Expand;54 ;Action,Platformer,Platformer,3D,3D
POKEMON DIAMOND VERSION;85;8.3;DS;Nintendo;Game Freak;Apr 22, 2007;Pokemon Diamond and Pearl are traditional Pokemon RPGs that takes place in a region called Sinnoh. When you set off on your travels, you'll be able to play as either a boy or girl Trainer. Pokemon fans have caught glimpses of Lucario, Munchlax and Weavile in Pokemon movies, and these Pokemon… Expand;42 ;Role-Playing,Console-style RPG,Console-style RPG,Trainer
FINAL FANTASY IV;85;8.4;DS;Square Enix;Matrix Software;Jul 21, 2008;Four elemental Crystals, each possessing awesome power, lie scattered throughout the realm. However, men are quick to covet things which offer strength, and easily corrupted by the might which they possess. Seduced by the promised power of the Crystals, the kingdom of Baron begins employing… Expand;52 ;Role-Playing,Console-style RPG,Console-style RPG,Japanese-Style
CASTLEVANIA: ORDER OF ECCLESIA;85;8.5;DS;Konami;Konami;Oct 21, 2008;The legendary Castlevania series is back in its 3rd installment on the Nintendo DS. This time you play as a member of the Ecclesia, an organization that has sworn to defeat the evil forces of Dracula. Use the brand new Glyph attack system which has more than 100 different combinations to… Expand;46 ;Action,Role-Playing,Platformer,Platformer,Action RPG,2D,2D
SPACE INVADERS EXTREME;85;7.9;DS;Square Enix;Taito Corporation;Jun 17, 2008;New Look: The classic design of the original SPACE INVADERS, now with revamped graphics and new background movies that add to the game’s excitement. New Music: Get in the groove with up-beat techno tunes that are synched to gameplay. New Mini-Games: Experience varied gameplay with mini-games… Expand;41 ;Action,Shooter,Shooter,Static,Static,Shoot-'Em-Up,Vertical
PEGGLE: DUAL SHOT;84;7.8;DS;PopCap;Q Entertainment;Feb 27, 2009;Shoot and clear the orange pegs from 120 levels spanning two full Adventure modes including 10 all-new levels in the exclusive Bonus Underground. Wield 11 Magic Powers, score amazing style shots, and collect valuable gems and power-ups in the Bonus Underground. And the action doesn’t stop… Expand;17 ;Miscellaneous,Puzzle,Action,Puzzle,Puzzle,Action
TETRIS DS;84;7.9;DS;Nintendo;Nintendo;Mar 20, 2006;10 DS players can battle with only one Tetris DS card. Each of the six modes of play features a theme based on a classic Nintendo game, such as Super Mario Bros., The Legend of Zelda or Metroid. The traditional Tetriminos (falling blocks) and line-clearing strategy remain the staples of the… Expand;56 ;Miscellaneous,Puzzle,Puzzle,Puzzle,Stacking,Stacking
SHIN MEGAMI TENSEI: DEVIL SURVIVOR;84;4.5;DS;Atlus;Atlus;Jun 23, 2009;Tokyo is in full lockdown, the government's swift, coldblooded response to a surprise demon invasion. Trapped within the sprawling metropolis is the city's helpless populace, forced to turn on each other in order to survive. A mysterious piece of technology, the COMP, falls into the hands… Expand;28 ;Role-Playing,Strategy,Turn-Based,General,General,Tactics
PROFESSOR LAYTON AND THE DIABOLICAL BOX;84;8.6;DS;Nintendo;Level 5;Aug 24, 2009;(Also known as "Professor Layton and Pandora's Box) Professor Layton needs your help! Get your wits working with over 150 puzzles, and help unravel the mystery of the Elysian Box. [Nintendo];65 ;Miscellaneous,Puzzle,Puzzle,General,Puzzle,General
DARK VOID ZERO;84;7.2;DS;Capcom;Other Ocean Interactive;Jan 18, 2010;[DSiWare] As the '80s were drawing to a close, the developers at Capcom began work on a top-secret project that aimed to set new standards for the platformer genre. That game was called Dark Void. Alas, Capcom suspended development on Dark Void as it began to evaluate the SNES. Before long,… Expand;14 ;Action,Platformer,Platformer,2D,2D
TONY HAWK'S AMERICAN SK8LAND;84;7.8;DS;Activision;Vicarious Visions;Nov 16, 2005;No levels. No load times. Just never-ending action that doesn't stop until you leave the game. Tony Hawk's American Wasteland gives you - for the first time ever in a Hawk game - the freedom to skate, or bike, throughout a rich, expansive open environment. Once you arrive in Los Angeles, the… Expand;31 ;Sports,Alternative,Individual,Skateboarding,Skateboarding,Skate / Skateboard
DRAGON QUEST V: HAND OF THE HEAVENLY BRIDE;84;8.6;DS;Square Enix;ArtePiazza;Feb 16, 2009;This entry in the Zenithia Trilogy follows a journey that transcends three generations. Travel alongside your father on his quest to see the world, grow to set forth on a journey of your own and face life-altering decisions as you continue your family’s legacy. [Square Enix];46 ;Role-Playing,Console-style RPG,Console-style RPG,Japanese-Style
GHOST TRICK: PHANTOM DETECTIVE;83;9.7;DS;Capcom;Capcom;Jan 11, 2011;Ghost Trick is a story of mystery and intrigue that blends fun logic puzzles with the world of the supernatural, making for an entirely new and unique experience in the handheld gaming space. Part adventure game, part puzzle game, Ghost Trick's gameplay will challenge player's brains while… Expand;60 ;Adventure,General,General
BANGAI-O SPIRITS;83;7.8;DS;D3Publisher;Treasure;Aug 12, 2008;Bangai-O Spirits provides gamers with addictive shooter gameplay, punishing supermoves and a sensory overload of fireworks onscreen, with strategic and tactical elements and TREASURE’s quirky design style. The game also offers co-op, competitive multiplayer for 1-4 players via local… Expand;38 ;Action,Shooter,Shooter,Scrolling,Scrolling,Shoot-'Em-Up,Vertical
BLEACH: THE BLADE OF FATE;83;7.3;DS;Sega;Treasure;Oct 9, 2007;(Also known as "Bleach DS") Players face a variety of opponents as one of 28 highly-stylized characters in intense action-packed battles based on the animated series. Bleach: The Blade of Fate on the Nintendo DS brings a twist to the traditional 2D fighting game with a new kind of battle… Expand;32 ;Action,Fighting,Fighting,2D,2D
PICROSS DS;83;8.0;DS;Nintendo;Jupiter Corporation;Jul 30, 2007;Like finding the underlining 'picture' in a 'crossword puzzle', the goal in Picross DS is to fill a grid with squares and crosses in order to 'paint' a picture. Numbers at the head of the puzzles' columns and rows signify how the grids need to be filled out, but it will take a sharp mind to… Expand;33 ;Miscellaneous,Puzzle,Puzzle,Puzzle,Logic,Logic
CLUBHOUSE GAMES;83;7.9;DS;Nintendo;Agenda;Oct 9, 2006;(Known in the UK/EU as "42 All-Time Classics") It's game night and everyone’s invited. Play more than 20 classic board, card and party games alone, with friends or via Nintendo Wi-Fi Connection. With familiar favorites like checkers, darts and poker, Clubhouse Games is for everyone and part… Expand;30 ;Miscellaneous,Board Games,Board Games,Board / Card Game,Party / Minigame
PICROSS 3D;83;8.1;DS;Nintendo;HAL Labs;May 3, 2010;Picross 3D is the sequel to the popular Picross DS puzzle game. The original game was a number-based grid puzzle that challenged players to reveal a hidden picture. Picross 3D moves the action into three dimensions. Picross 3D blends the logical challenge of a sudoku puzzle with the… Expand;35 ;Miscellaneous,Puzzle,Puzzle,Puzzle,Logic,Logic
MIGHTY FLIP CHAMPS!;83;7.7;DS;WayForward;WayForward;Jun 1, 2009;[DSiWare] Are you ready to become a Mighty Flip Champ? Take control of Alta and page-flip through a series of action-packed mazes. The touch screen reflects a preview of the next chamber and shows Alta's projected destination within it. When it's time to flip, use Alta's Magical Warp Wand… Expand;9 ;Puzzle,Action,General,General
NINTENDOGS: CHIHUAHUA & FRIENDS;83;8.0;DS;Nintendo;Nintendo;Aug 22, 2005;Players care for and train their puppy by petting it, walking it and buying it supplies to play with. As a puppy competes in obedience and agility trials, owners can win money to purchase other puppy breeds. The pups will vary in gender, coloration and personality. Players purchase one of… Expand;55 ;Simulation,Miscellaneous,Virtual Life,Virtual Life,Virtual,Pet
ART STYLE: PICTOBITS;83;7.6;DS;Nintendo;Nintendo;May 18, 2009;[DSiWare. Also known as "Art Style: PiCOPiCT"] Your goal in Art Style: PiCTOBiTS is simple: clear large blocks that fall from above ("megabits") by combining them with "bits" (square blocks) of the same color. Add in the ability to pick up bits and place them anywhere on the touch screen,… Expand;9 ;Miscellaneous,Puzzle,Puzzle,Puzzle,Matching,Matching
PROFESSOR LAYTON AND THE LAST SPECTER;83;8.3;DS;Nintendo;Level 5;Oct 18, 2011;Professor Layton and The Devil Flute is the fourth game in the puzzling series.;58 ;Miscellaneous,Puzzle,Puzzle,General,Puzzle,General
NINTENDOGS: LAB & FRIENDS;83;7.6;DS;Nintendo;Nintendo;Aug 22, 2005;Players care for and train their puppy by petting it, walking it and buying it supplies to play with. As a puppy competes in obedience and agility trials, owners can win money to purchase other puppy breeds. The pups will vary in gender, coloration and personality. Players purchase one of… Expand;54 ;Simulation,Miscellaneous,Virtual Life,Virtual Life,Virtual,Pet
NINJA GAIDEN: DRAGON SWORD;83;7.8;DS;Tecmo;Team Ninja;Mar 25, 2008;Uncover all the mysteries of Ninja Gaiden Dragon Sword as you fight enemy ninjas and battle various fiends while taking on the role of Master Ninja, Ryu Hayabusa, in an all new storyline for the Nintendo DS. Innovative DS Stylus Functionality: Smoothly maneuver and fight through levels with… Expand;52 ;Action Adventure,Fantasy,General,Fantasy
DRAGON QUEST HEROES: ROCKET SLIME;83;7.8;DS;Square Enix;Square Enix;Sep 19, 2006;(Known in Japan as "Slime Mori Mori Dragon Quest 2") The hero of this action-adventure is a slime—one of the most popular monsters from the Dragon Quest series. The game is set in the kingdom of Slimenia, a peaceful land that is suddenly invaded by a mysterious cartel called "the Plob," who… Expand;41 ;Action Adventure,Fantasy,General,Fantasy,Open-World
CONTRA 4;83;8.0;DS;Konami;WayForward;Nov 13, 2007;Contra 4 takes place two years after "Contra III: The Alien Wars," first released on the Super Nintendo in 1992. Heroes Bill and Lance again must team up to take down an oncoming alien invasion and its leader, Black Viper. Contra 4 features the same style of 2D side-scrolling gameplay that… Expand;38 ;Action,Platformer,Platformer,2D,2D
RHYTHM HEAVEN;83;8.4;DS;Nintendo;Nintendo;Apr 5, 2009;(Also known as "Rhythm Paradise") Rhythm Heaven is a simple and infectious rhythm game that anyone can play. If you can tap your finger in time to music, you'll get the hang of Rhythm Heaven in no time. Players hold the Nintendo DS system sideways like a book and tap their stylus on the… Expand;48 ;Action,Miscellaneous,Rhythm,Music,Music
NINTENDOGS: DALMATIAN & FRIENDS;83;7.4;DS;Nintendo;Nintendo;Oct 16, 2006;Go dotty for Nintendogs Dalmatian & Friends edition. The highly desirable Dalmatian is availalbe from the start. plus own teh most popular pups from previous editions: Boxer, German Shepherd, Golden Retriever, Yorkshire Terrier, Beagle and more. Link up with friends in Bark Mode and give… Expand;7 ;Simulation,Miscellaneous,Virtual Life,Virtual Life,Virtual,Pet
KIRBY MASS ATTACK;83;8.1;DS;Nintendo;HAL Labs;Sep 19, 2011;One day, an evildoer with a magic cane appears and splits Kirby into 10 pieces. Kirby sets off on a journey to return to his original form. Players use the touch screen to control a mass of Kirby characters in a new and novel way. Swipe the touch screen to launch them in a mass attack… Expand;46 ;Action,Platformer,Platformer,2D,2D
DRAGON QUEST WARS;83;5.6;DS;Square Enix;Intelligent Systems;Sep 28, 2009;[DSiWare] DRAGON QUEST WARS is a grid-based strategy game featuring all of your favorite quirky DRAGON QUEST monsters. Choose from several modes and get ready for battle. While the rules are simple, strategy is the key to victory. The game features single-player and DS Wireless Play, as… Expand;8 ;Strategy,Turn-Based,Fantasy,General,Fantasy
NINTENDOGS: DACHSHUND & FRIENDS;83;7.9;DS;Nintendo;Nintendo;Aug 22, 2005;Players care for and train their puppy by petting it, walking it and buying it supplies to play with. As a puppy competes in obedience and agility trials, owners can win money to purchase other puppy breeds. The pups will vary in gender, coloration and personality. Players purchase one of… Expand;53 ;Simulation,Miscellaneous,Virtual Life,Virtual Life,Virtual,Pet
POKEMON PLATINUM VERSION;83;8.9;DS;Nintendo;Game Freak;Mar 22, 2009;As the story unfolds, players encounter the mysterious new Distortion World, an area unlike any seen in a Pokemon video game before. The Battle Frontier area (first introduced in Pokemon Emerald) has been added to Sinnoh, containing five new Battle Facilities for Trainers to challenge, each… Expand;46 ;Role-Playing,Console-style RPG,Console-style RPG,Trainer
