DUNGEONS & DRAGONS: CHRONICLES OF MYSTARA;83;6.8;PlayStation 3;Capcom;Iron Galaxy Studios;Jun 18, 2013;As the first modern role playing game, the Dungeons & Dragons franchise from Wizards of the Coast gave birth to numerous products including two arcade titles from Capcom, Dungeons & Dragons: Tower of Doom and its sequel Dungeons & Dragons: Shadow over Mystara. Both these titles… Expand;18 ;Action,Miscellaneous,Beat-'Em-Up,Compilation,Compilation
MARVEL PINBALL;83;7.5;PlayStation 3;Zen Studios;Zen Studios;Dec 14, 2010;Marvel Pinball will include tables for Wolverine, Spider-Man, Iron Man, and Blade.;17 ;Action,Miscellaneous,Parlor,Pinball,Pinball
ULTRA STREET FIGHTER IV;83;7.6;PlayStation 3;Capcom;Capcom;Jun 3, 2014;The series evolves to a whole new level with Ultra Street Fighter IV for PlayStation 3, Xbox 360, and PC. Continuing the tradition of excellence the series is known for, five new characters and six new stages have been added for even more fighting mayhem, with rebalanced gameplay and… Expand;28 ;Fighting,3D,Action,Fighting,2D,3D
PURE;83;7.5;PlayStation 3;Disney Interactive Studios;Black Rock Studio;Sep 23, 2008;Thrill seekers race against skilled rivals and performing gravity-defying aerial tricks in Pure, an extreme sports off-road racing video game. Featuring vertigo-inducing massive aerial jumps and spectacular airborne tricks in photo-realistic real-world locations all over the globe, Pure… Expand;43 ;Driving,Racing,Arcade,Arcade,Automobile
PIXELJUNK MONSTERS;83;8.2;PlayStation 3;SCEA;Q-Games;Jan 24, 2008;[Downloadable Game] Inspired by the popular and addictive "tower defense" genre, PixelJunk Monsters takes the simple real-time strategy concept of building, researching and base defending and presents it in a uniquely attractive style. With meticulously hand-drawn 2D art, PixelJunk Monsters… Expand;38 ;Strategy,Real-Time,Fantasy,Fantasy,Defense
COMET CRASH;83;7.3;PlayStation 3;Pelfast;Pelfast;Apr 2, 2009;[Playstation Network] Comet Crash takes real-time strategy to a new level by blending classical tower defense gameplay with offensive counterattacks and dynamic AI. Choose among a variety of weapons to defend your territory. Use specialized units to fight off attacks. Build up massive… Expand;16 ;Strategy,General,General
BEYOND GOOD & EVIL HD;83;8.5;PlayStation 3;Ubisoft;Ubisoft;Jun 28, 2011;Featuring epic boss fights, puzzle-solving and stealth-based games, Beyond Good & Evil broke the barriers of traditional action-adventure gameplay when it was released in 2003. The story follows Jade, and investigative reporter and martial artist, who works with a resistance agency to… Expand;13 ;Action Adventure,Fantasy,General,Fantasy
MADDEN NFL 11;83;6.1;PlayStation 3;Electronic Arts;EA Tiburon;Aug 10, 2010;Madden NFL 11 promises to redefine the way you experience the game of football. SIMPLER: From 350 plays down to 1, the all-new GameFlow system puts you in the helmet of an NFL quarterback to execute an authentic, situational game plan, one play at a time. QUICKER: 60 minute game times… Expand;36 ;Sports,Traditional,Team,Football,Sim,Sim
NBA 2K10;83;7.8;PlayStation 3;2K Sports;Visual Concepts;Oct 6, 2009;NBA Today - All the real world matchups, news and stats are automatically streamed right into your game. No longer will your commentary and overlays be stale and out of date. NBA Today keeps everything fresh and up to date based upon what is really happening in the NBA. My Player Mode -… Expand;30 ;Sports,Traditional,Team,Basketball,Sim,Sim
DARK SOULS II: CROWN OF THE OLD IRON KING;83;8.1;PlayStation 3;Namco Bandai Games;From Software;Aug 26, 2014;Crown of the Old Iron King features an entirely different world within the Dark Souls II universe where players will venture into a massive tower swamped by black mist where flames, smoke and sorcery sadistically lurk.;11 ;Role-Playing,Action RPG
FINAL FANTASY XIII;83;7.2;PlayStation 3;Square Enix;Square Enix;Mar 9, 2010;In Final Fantasy XIII, you will embark on a journey through the cityworld of Cocoon and the outerworld of Pulse. Along the way, you will encounter diverse allies who will fight alongside you. Execute powerful attacks with weapons and magic, and summon the enigmatic Eidolons with an evolved… Expand;83 ;Role-Playing,Console-style RPG,Console-style RPG,Japanese-Style
BORDERLANDS;83;7.8;PlayStation 3;2K Games;Gearbox Software;Oct 20, 2009;As the first title in an all-new sci-fi action franchise, Borderlands combines the best elements of Gearbox Software's first-person action titles with player customization and vehicular combat. Borderlands features a unique content generation system allowing for near-endless variety in… Expand;58 ;Action,Shooter,Shooter,First-Person,Sci-Fi,Sci-Fi,Arcade
EVERYDAY SHOOTER;83;7.3;PlayStation 3;SCEA;Backbone Entertainment;Oct 11, 2007;[Downloadable Game] Developed solely by Jonathan Mak, Everyday Shooter won three awards at the Independent Gaming Festival at the 2007 Game Developers Conference. Unlike traditional arcade shooters, the sound effects in Everyday Shooter play in musical harmony with the game’s background… Expand;26 ;Action,Shooter,Shooter,Static,Static,Shoot-'Em-Up,Top-Down
JUST CAUSE 2;83;8.0;PlayStation 3;Square Enix;Avalanche Studios;Mar 23, 2010;Developed by Avalanche Studios, Just Cause 2 finds Rico Rodriguez returning in an epic open-world adventure set in the diverse tropical playground of Panau in South East Asia, where the aim is to cause chaos and destruction in a way that only Rico knows how! His mission is to destabilize the… Expand;66 ;Action Adventure,Modern,Modern,Open-World
FIGHT NIGHT ROUND 3;83;7.9;PlayStation 3;EA Sports;EA Chicago;Dec 5, 2006;Go toe-to-toe with greats such as Ali, De La Hoya, Joe Frazier, Bernard Hopkins and Roy Jones. Outside of the ring, gamers can establish intense rivalries through pre-fight events putting purpose and passion behind every hit. Three new Impact Punches a la the EA Sports Haymaker keep gamers… Expand;37 ;Sports,Traditional,Individual,Boxing,Boxing,Combat,Boxing / Martial Arts
STEINS;GATE;83;8.6;PlayStation 3;5pb ;Nitro+;Jun 5, 2015;Okabe Rintaro -- aka Okarin -- is an eccentric college student who dreams of conspiracy and chaos. Adopting the persona of a mad scientist, he spends his time developing oddball gadgets with his friends in their makeshift laboratory.One day, they accidentally discover that one of their… Expand;8 ;Adventure,General,Visual Novel
MADDEN NFL 13;83;5.4;PlayStation 3;EA Sports;EA Tiburon;Aug 28, 2012;Powered by the all-new Infinity Engine, true player impact and authentic momentum transfer ensure that no two plays ever look or feel the same. Connected Careers is a new and fully connected universe defined by deep gameplay, unique storylines and social integration.;22 ;Sports,Traditional,Team,Football,Sim,Sim
RESISTANCE 3;83;7.8;PlayStation 3;SCEA;Insomniac Games;Sep 6, 2011;Set in a brutal, alternate 1950s universe, America has been successfully conquered and destroyed by the deadly Chimeran race, forcing the last remaining human survivors to seek refuge in hiding. Players must take on the role of Joseph Capelli, the last surviving Sentinel from a clandestine… Expand;91 ;Action,Shooter,Shooter,First-Person,Sci-Fi,Modern,Sci-Fi,Arcade
RATCHET & CLANK COLLECTION;83;8.4;PlayStation 3;SCEA;Idol Minds;Aug 28, 2012;Also known as "The Ratchet & Clank Trilogy" - Ratchet & Clank Collection includes Ratchet & Clank, Ratchet & Clank: Going Commando, and Ratchet & Clank: Up Your Arsenal all remastered.;40 ;Action,Platformer,3D,Miscellaneous,Compilation,Compilation
SINE MORA;83;7.4;PlayStation 3;Digital Reality;Digital Reality;Nov 20, 2012;Sine Mora is a side-scrolling shooting game dealing with time manipulation.;9 ;Action,Shooter,Shooter,Scrolling,Scrolling,Shoot-'Em-Up,Vertical,Horizontal
TRINE;83;7.8;PlayStation 3;Nobilis;Frozenbyte, Inc.;Oct 22, 2009;Trine is a physics-based action game where three characters allow clever solutions to challenges created by hazardous puzzles and threatening enemies. The gameplay is based on fully interactive physics - each character's different abilities and tactics can be used to invent new ways to… Expand;24 ;Action,Action Adventure,Fantasy,General,Platformer,Fantasy,2D
INFAMOUS 2;83;8.6;PlayStation 3;SCEA;Sucker Punch;Jun 7, 2011;Blamed for the destruction of Empire City and haunted by the ghosts of his past, reluctant hero Cole MacGrath makes a dramatic journey to the historic Southern city of New Marais in an effort to discover his full super-powered potential -- and face a civilization-ending confrontation with a… Expand;90 ;Action Adventure,Sci-Fi,Sci-Fi,Open-World
YAKUZA 5;83;8.7;PlayStation 3;Sega;Ryu ga Gotoku Studios;Dec 8, 2015;The legendary dragon returns to the criminal underworld of Yakuza. Kazuma Kiryu, once known as the Dragon of Dojima, was living a quiet life as a taxi driver in Hakata after severing all his ties with the underworld. However, at the dawn of the bloody war between the Tojo Clan and the Omi… Expand;34 ;Modern,Action Adventure,Open-World
DIRT;83;8.1;PlayStation 3;Codemasters;Codemasters;Sep 11, 2007;(Formerly known as "Colin McRae Rally 2007" or "CMR '07") After a two-year break for the series, Codemasters Studios' designers have created a reinvigorated McRae experience. The new Colin McRae title goes beyond the series' point-to-point rallying to deliver the most diverse selection of… Expand;32 ;Driving,Racing,Simulation,Rally / Offroad,Rally / Offroad,Automobile
OUTLAND;83;7.8;PlayStation 3;Ubisoft;Housemarque;Jun 14, 2011;Outland puts players in the middle of a world of balance and chaos where their efforts allow them to bridge the ancient divide, or doom the world to destruction. Each player’s adventure will take them between light and darkness and force them to adapt to an ever-changing world. This light… Expand;28 ;Action,Platformer,Platformer,3D,2D
SKYLANDERS SWAP FORCE;83;5.7;PlayStation 3;Activision;Vicarious Visions;Oct 13, 2013;In Skylanders SWAP Force, Portal Masters embark on an adventure in the mysterious Cloudbreak Islands, where a magical volcano gives the heroes the power to swap halves, turning them into a special team known as the SWAP Force. By reassembling this team, Portal Masters must send back Kaos and… Expand;31 ;Action,Platformer,Platformer,3D,3D
NINJA GAIDEN SIGMA 2;83;7.8;PlayStation 3;Tecmo;Team Ninja;Sep 29, 2009;The most intense, challenging, action-packed ninja adventure is back, exclusively on the PS3. From Tokyo to New York, follow super ninja Ryu as he encounters vicious enemies and acquires an extensive assortment of ninja weaponry along the way. New Playable Characters: Ninja Gaiden's Rachel,… Expand;52 ;Action Adventure,Fantasy,General,Fantasy
SLEEPING DOGS;83;7.7;PlayStation 3;Square Enix;United Front Games;Aug 14, 2012;Sleeping Dogs is an open world cop drama set in the vibrant city of Hong Kong. Taking the role of undercover cop Wei Shen, players must take down one of the world's most lethal criminal organizations from the inside. Featuring imaginative combat systems, Sleeping Dogs empowers enables… Expand;40 ;Action Adventure,Modern,Modern,Open-World
STACKING;83;7.7;PlayStation 3;THQ;Double Fine Productions;Feb 8, 2011;Stacking is the second downloadable game produced by THQ and the award-winning Double Fine Productions. The adventure of Stacking requires players to capture and stack dolls together, then use each doll's unique abilities to solve the game's challenges. As more puzzles are solved, new dolls… Expand;44 ;Miscellaneous,Puzzle,Action,Puzzle,Puzzle,Action
HITMAN: ABSOLUTION;83;7.5;PlayStation 3;Square Enix;Io Interactive;Nov 20, 2012;Wear the uniform of the deadliest assassin, you have the ability to blend into your environment, kill with nothing but your bare hands and create a weapon from almost anything a la McGuyver. You are Agent 47, the world's most lethal assassin.;30 ;Action Adventure,Modern,General,Modern
CALL OF DUTY: BLACK OPS II;83;5.7;PlayStation 3;Activision;Treyarch;Nov 13, 2012;Call of Duty: Black Ops II thrusts players into a potential near future - a 21st Century Cold War in which technology and weapons have merged to create a new generation of warfare. Black Ops 2 introduces players to an insidious villain named Raul Menendez who hijacks the US military… Expand;21 ;Action,Shooter,Shooter,First-Person,Historic,Modern,Modern,Arcade
GUITAR HERO III: LEGENDS OF ROCK;83;7.8;PlayStation 3;Activision ;Neversoft Entertainment;Oct 28, 2007;Fire up the fretboard, crank up the amp and get ready to rock like never before. Guitar Hero III: Legends of Rock drops you into the spotlight of the largest and most legendary rock concert ever. The star-studded soundtrack includes master tracks by such legendary artists as Guns N’ Roses,… Expand;45 ;Action,Miscellaneous,Rhythm,Music,Music
BRUTAL LEGEND;83;7.6;PlayStation 3;EA Games;Double Fine Productions;Oct 13, 2009;Brütal Legend is an epic action game from visionary developer Tim Schafer. Jack Black stars as Eddie Riggs, a legendary roadie summoned to a world of Heavy Metal where mountains are made of amplifiers, killer spiders spin guitar strings and Rock Legends roam the landscape. As Eddie, crush… Expand;61 ;Action,Action Adventure,General,Fantasy,General,Fantasy,Open-World
BATTLEFIELD 3: BACK TO KARKAND;83;7.5;PlayStation 3;Electronic Arts;EA DICE;Dec 6, 2011;Battlefield 3: Back to Karkand is a massive themed expansion pack featuring four of the most loved maps from Battlefield 2, boldly reimagined for Battlefield 3 with the power and destruction of the Frostbite 2 engine. It also gives you classic weapons and vehicles from Battlefield 2, unique… Expand;8 ;Action,Shooter,Shooter,First-Person,Modern,Tactical,Modern,Arcade
SPELUNKY;83;7.7;PlayStation 3;Mossmouth;Mossmouth;Aug 27, 2013;Spelunky is a unique platformer with randomized levels that offer a new and challenging experience each time you play! Journey deep underground and explore fantastic places filled with monsters, traps, and treasure. Fully-destructible environments open up lots of strategies and make it a… Expand;8 ;Action,Platformer,Platformer,2D,2D
DARK SOULS II: CROWN OF THE SUNKEN KING;83;8.0;PlayStation 3;Bandai Namco Games;Namco Bandai Games;Jul 22, 2014;Embark on a journey to reclaim a crown that Drangleic's King Vendrick once owned. This perilous quest will lead you through an entirely different world within the Dark Souls II universe, where stepped pyramids span a vast underground cavern. It is said that one of the ancient crowns lay… Expand;18 ;Role-Playing,Action RPG
F1 2011;82;7.2;PlayStation 3;Codemasters;Codemasters;Sep 20, 2011;In F1 2011 players will be challenged to ‘Be the driver, live the life, go compete,’ with wide-ranging technical and gameplay advancements on and off track and vastly extended competitive and co-operative multiplayer components. F1 2011 will feature all of the official teams, drivers and… Expand;36 ;Driving,Racing,Simulation,Formula One,Formula One,Automobile
SINGSTAR (2008);82;6.1;PlayStation 3;SCEA;SCEE London Studio;May 20, 2008;SingStar PS3 takes the successful interactive singing experience established with the multi-million selling global PlayStation2 franchise to the next level with personalization and community taking center stage. SingStar PS3 allows you access to a catalog of hundreds of downloadable songs… Expand;48 ;Action,Miscellaneous,Rhythm,Music,Music
THE WOLF AMONG US: EPISODE 2 - SMOKE AND MIRRORS;82;8.2;PlayStation 3;Telltale Games;Telltale Games;Feb 4, 2014;The Wolf Among Us is a five episode series from the creators of the 2012 Game of the Year: The Walking Dead. Based on Fables (DC Comics/Vertigo), an award-winning comic book series, it is an often violent, mature and hard-boiled thriller where the characters and creatures of myth, lore and… Expand;9 ;Action Adventure,Adventure,General,Fantasy,Point-and-Click
LEGO MARVEL SUPER HEROES;82;7.8;PlayStation 3;Warner Bros. Interactive Entertainment;TT Games;Oct 22, 2013;LEGO Marvel Super Heroes features an original story where players take control of Iron Man, Spider-Man, the Hulk, Captain America, Wolverine and many more Marvel characters as they unite to stop Loki and a host of other Marvel villains from assembling a super-weapon capable of destroying the world.;22 ;Action Adventure,Fantasy,General,Fantasy,Open-World
SAINTS ROW: THE THIRD;82;7.8;PlayStation 3;THQ;Volition Inc.;Nov 15, 2011;Years after taking Stilwater for their own, the Third Street Saints have evolved from street gang to household brand name, with Saints sneakers, Saints energy drinks and Johnny Gat bobble head dolls all available at a store near you. The Saints are kings of Stilwater, but their celebrity… Expand;50 ;Action Adventure,Modern,Modern,Open-World
TIGER WOODS PGA TOUR 09;82;7.1;PlayStation 3;Electronic Arts;EA Tiburon;Aug 26, 2008;This year's Tiger features dynamic, personalized gameplay via Tiger Woods' personal coach, Hank Haney. Looking to drive the ball long and straight? Trying to nail the pin with the approach shot? An all-new addition to this year’s game, Haney will assist gamers as they hit the links and try… Expand;34 ;Sports,Traditional,Individual,Golf,Sim,Sim
2010 FIFA WORLD CUP SOUTH AFRICA;82;7.8;PlayStation 3;EA Sports;EA Canada;Apr 27, 2010;EA SPORTS 2010 FIFA World Cup South Africa features all the emotion and passion of the fiercest national rivalries battling on the world’s biggest stage, with all 199 national teams that took part in qualification, all 10 official stadiums to be used in South Africa and stadiums from each… Expand;56 ;Sports,Traditional,Team,Soccer,Sim,Sim
LEGO THE LORD OF THE RINGS;82;8.3;PlayStation 3;Warner Bros. Interactive Entertainment;TT Games;Nov 13, 2012;LEGO The Lord of the Rings retells the story of the Lord of the Rings Trilogy through the visuals of the LEGO universe.;16 ;Miscellaneous,Action Adventure,Adventure,General,General,Compilation,Linear
DYAD;82;5.9;PlayStation 3;SCEA;Right Square Bracket Left Square Bracket Games;Jul 17, 2012;Dyad reveals to you the secrets of the universe via bright flashy colors and phat beatz. A gamified tie dye machine. An interactive mind altering substance absorbed through your thumbs, eyes and ears. A tactical octopus action ballet in a reactive audio-visual tube. Experience a… Expand;33 ;Driving,Racing,Arcade,Futuristic,Futuristic
SONIC & ALL-STARS RACING TRANSFORMED;82;8.3;PlayStation 3;Sega;Sumo Digital;Nov 18, 2012;Sonic and the All-Stars cast battle for supremacy across land, water and air in transforming vehicles that change from cars to boats to planes mid-race.;24 ;Driving,Racing,Arcade,Kart,Other,Kart,Automobile
NBA 2K9;82;7.1;PlayStation 3;2K Sports;Visual Concepts;Oct 7, 2008;Improved facial and skin textures, better uniforms, improved eye movement and more realistic crowd reactions bring the game alive like never before. Analyst Clark Kellogg and sideline reporter Cheryl Miller join color commentator Kevin Harlan to create one of the most knowledgeable broadcast… Expand;30 ;Sports,Traditional,Team,Basketball,Sim,Sim
TOP SPIN 4;82;8.1;PlayStation 3;2K Sports;2K Czech;Mar 15, 2011;Top Spin 4 is the latest iteration in the tennis sim, bringing 25 playable pros as well as the ability to create your own star.;37 ;Sports,Traditional,Individual,Tennis,Tennis
THE WALKING DEAD: SEASON TWO EPISODE 2 - A HOUSE DIVIDED;82;8.4;PlayStation 3;Telltale Games;Telltale Games;Mar 4, 2014;Season Two continues the story that began in Season One. You are Clementine, a young survivor in a world gone to hell. The dead have risen to feast on the living, and the living cannot be trusted.The story you experience in The Walking Dead Season Two is driven by the choices that you… Expand;8 ;General,Action,Adventure,General,Point-and-Click
DARKSIDERS;82;7.9;PlayStation 3;THQ;Vigil Games;Jan 5, 2010;Penned by legendary comic book artist Joe Madureira (X-Men, Battle Chasers, The Ultimates), Darksiders is set in a Post-Apocalyptic demon-ravaged world where evil forces have prematurely brought about the end of the time. Originally sent to oversee the destruction of Earth, the Four Horsemen… Expand;73 ;Action Adventure,Modern,Modern,Open-World
SUPER PUZZLE FIGHTER II TURBO HD REMIX;82;7.4;PlayStation 3;Capcom;Backbone Entertainment;Aug 30, 2007;[Downloadable Game] Super Puzzle Fighter II Turbo HD Remix downloads Capcom's popular puzzle game into the new generation. The new version of the game features newly created 1080p HD graphics, several new game modes, improved game balance, new stage backgrounds courtesy of Udon… Expand;7 ;Miscellaneous,Puzzle,Puzzle,Puzzle,Matching,Matching
SKULLGIRLS;82;7.1;PlayStation 3;Autumn Games;Reverge Labs;Apr 10, 2012;Skullgirls is a fast 2-D fighting game that puts you in control of fierce warriors in a Dark Deco world. New game systems test the skills of veteran fighting game fans while also making the genre enjoyable and accessible to newcomers. A modern take on classic arcade fighters with a… Expand;25 ;Action,Fighting,Fighting,2D,2D
PIXELJUNK SHOOTER 2;82;7.7;PlayStation 3;SCEA;Q-Games;Mar 1, 2011;PixelJunk Shooter returns with more levels and new features.;41 ;Action,General,Shooter,Shooter,Static,Static,Shoot-'Em-Up,Top-Down
TEKKEN TAG TOURNAMENT 2;82;8.3;PlayStation 3;Namco Bandai Games;Namco Bandai Games;Sep 11, 2012;The Tekken Tag Tournament returns with fighters from across the Tekken spectrum taking each other on two by two for the second time.;50 ;Action,Fighting,Fighting,3D,3D
DRAGON AGE II;82;4.4;PlayStation 3;Electronic Arts;BioWare;Mar 8, 2011;EA announced that a new installment in the Dragon Age series will arrive in the first quarter of 2011.;52 ;Role-Playing,PC-style RPG,Action RPG
VIRTUA FIGHTER 5 FINAL SHOWDOWN;82;6.2;PlayStation 3;Sega;Sega AM2;Jun 5, 2012;Virtua Fighter 5 Final Showdown contains the definite version of Virtua Fighter 5, refined over the years since its original arcade debut. The new release also adds an extensive list of features never before seen on consoles. Virtua Fighter 5 Final Showdown, will contain a full overhaul of… Expand;21 ;Action,Fighting,Fighting,3D,3D
CONDEMNED 2: BLOODSHOT;82;8.0;PlayStation 3;Sega;Monolith Productions;Mar 18, 2008;Featuring new fighting mechanics and online multiplayer functionality, Condemned 2: Bloodshot is a first-person action thriller immersing players in a world of psychological terror. Following a string of gruesome murders, players must use their deductive skills and brute force to track down… Expand;37 ;Action Adventure,Horror,Horror,Survival
FALLOUT: NEW VEGAS;82;8.0;PlayStation 3;Bethesda Softworks;Obsidian Entertainment;Oct 19, 2010;The latest game in the post-nuclear RPG series is being developed by many members of the Fallout 1 and 2 team at Obsidian Entertainment using the Fallout 3 engine.;57 ;Role-Playing,Action RPG,First-Person,First-Person,Western-Style
PRO EVOLUTION SOCCER 2013;82;7.0;PlayStation 3;Konami;Konami;Sep 25, 2012;PES bounds back onto the pitch to showcase new skills. Pro Evolution Soccer 2013 returns to the roots of football with unique levels of control plus major emphasis on the individual style of the world's best players. Thanks to feedback from dedicated fans, PES2013 offers total freedom to… Expand;37 ;Sports,Traditional,Team,Soccer,Sim,Sim
GRID 2;82;6.6;PlayStation 3;Codemasters;Codemasters;May 28, 2013;The next generation of the EGO Game Technology Platform promises to deliver genre-defining visuals and jaw-dropping damage as you prove yourself across three continents in a new, evolving world of motorsport.;20 ;Driving,Racing,Simulation,GT / Street,GT / Street,Automobile
COLLEGE HOOPS 2K8;82;5.9;PlayStation 3;2K Sports;Visual Concepts;Nov 19, 2007;In the All-American Training Challenge, players can improve their game skills by competing in passing, shooting, and defensive tests against former college basketball standouts like Mike Conley Jr. of Ohio State, Julian Wright of Kansas, Glen "Big Baby" Davis of LSU, Alando Tucker of… Expand;18 ;Sports,Traditional,Team,Basketball,Sim,Sim
DRAGON'S CROWN;82;8.4;PlayStation 3;Atlus;Vanillaware;Aug 6, 2013;Dragon's Crown thrusts you into a fantastical medieval world packed with labyrinthine dungeons to explore, vile monstrosities to smite, and nearly endless online adventure. Your mission is to dive into the dank underworld, uncovering treasure and strengthening your mettle as you unlock the… Expand;62 ;Action RPG,Action,Role-Playing,Beat-'Em-Up,Action RPG,Beat-'Em-Up,2D
ODDWORLD: STRANGER'S WRATH HD;82;8.5;PlayStation 3;Oddworld Inhabitants;Just Add Water;Dec 27, 2011;The Fabled Oddworld Series Makes its Return in High Definition in Oddworld: Stranger's Wrath HD.;29 ;Action Adventure,Fantasy,General,Fantasy
PINBALL HALL OF FAME: THE WILLIAMS COLLECTION;82;7.9;PlayStation 3;System 3;Farsight Studios;Sep 22, 2009;Pinball Hall of Fame: The Williams Collection faithfully recreates eight of the most memorable tables from the golden age of pinball in photorealistic 3D. Working closely with Williams to ensure authenticity of each of the games, the collection is highlighted by some of the most popular and… Expand;16 ;Action,Miscellaneous,Parlor,Pinball,Pinball
MIDNIGHT CLUB: LOS ANGELES;82;8.3;PlayStation 3;Rockstar Games;Rockstar San Diego;Oct 20, 2008;Whether driving by the beach or beating the competition by cutting through a parking garage at 200 mph, Midnight Club: Los Angeles provides a seamless, breathtaking environment for everyone who loves to compete. With no load times, no tracks, and no rules, the game allows players to race who… Expand;50 ;Driving,Racing,Simulation,GT / Street,GT / Street,Automobile
