FAR CRY 3: BLOOD DRAGON;82;8.2;PlayStation 3;Ubisoft;Ubisoft Montreal;Apr 30, 2013;Far Cry 3: Blood Dragon is a spin-off that contains around eight hours of original content and features a single open-world island to explore, with many of Far Cry 3's gameplay systems and mechanics making a return.;24 ;Action,Shooter,Shooter,First-Person,Modern,Modern,Arcade
BORDERLANDS: THE ZOMBIE ISLAND OF DR. NED;82;7.4;PlayStation 3;2K Games;Gearbox Software;Nov 24, 2009;(Downloadable Content) The Zombie Island of Dr. Ned is an add-on pack for Borderlands with new enemy types, new missions, and new ... surprises. The Jakobs Corporation would like to invite you to experience the splendor of a corporate owned small town known as Jakobs Cove. Any rumors you… Expand;12 ;Action,Shooter,Shooter,First-Person,Sci-Fi,Sci-Fi,Arcade
MODNATION RACERS;82;8.4;PlayStation 3;SCEA;United Front Games;May 25, 2010;Exclusive to the PlayStation 3 and PSP systems, ModNation Racers empowers the player to customize their entire kart racing experience. Enjoy karting fun, where you can shoot, boost & drift your way to the finish line. Create your unique racing experience with the same tools used by the… Expand;85 ;Driving,Racing,Arcade,Kart,Other,Kart
PIXELJUNK MONSTERS ENCORE;82;8.3;PlayStation 3;SCEA;Q-Games;May 8, 2008;[Dowloadable Game] PixelJunk Monsters Encore is an expansion pack to the tower defense game, PixelJunk Monsters. Encore includes 15 levels on a new map, "Toki Island", as well as the ability for players to track their score across both maps. Just as in the original game, Encore continues… Expand;7 ;Strategy,Real-Time,Fantasy,Fantasy,Defense
MOTORSTORM: PACIFIC RIFT;82;8.1;PlayStation 3;SCEA;Evolution Studios;Oct 28, 2008;The brutal offroad racing festival is back, with players this time attempting to tackle the diversity and unpredictability of a remote Pacific island environment. MotorStorm: Pacific Rift revisits the intense racing action introduced in last year's MotorStorm, this time allowing players to… Expand;63 ;Driving,Racing,Simulation,Rally / Offroad,Rally / Offroad,Automobile
YOU DON'T KNOW JACK;82;8.2;PlayStation 3;THQ;Jellyvision;Feb 8, 2011;The classic smart-aleck quiz show game is making its debut on current-generation consoles.;11 ;Miscellaneous,Trivia / Game Show,Trivia / Game Show
NCAA FOOTBALL 12;82;5.8;PlayStation 3;EA Sports;EA Sports;Jul 12, 2011;NCAA Football 12 is the next iteration in EA's NCAA Football series.;17 ;Sports,Traditional,Team,Football,Sim,Sim
SAINTS ROW 2;82;7.9;PlayStation 3;THQ;Volition Inc.;Oct 14, 2008;Saints Row 2 is set years after the original Saints Row in a Stilwater both familiar and strange. The explosive conclusion to Saints Row has left the player wounded, betrayed and thirsty for revenge, and now it's time to take back the city that has forgotten him. A sequel to the first… Expand;50 ;Action Adventure,Modern,Modern,Open-World
TEKKEN 5: DARK RESURRECTION;82;7.8;PlayStation 3;Namco Bandai Games America ;Namco Bandai Games;Mar 1, 2007;[Downloadable Game] The beauty of TEKKEN is re-created at 1080p and optimized for the HD era, delivering one of the most realistic graphics on the PS3 platform. Play as one of over 30 characters, including classics Jin, Heihachi, Paul, Law and more. New to Dark Resurrection, play as… Expand;20 ;Action,Fighting,Fighting,3D,3D
BLUR;81;8.2;PlayStation 3;Activision ;Bizarre Creations;May 25, 2010;Blur is a new style of powered-up racing. The game drops players into heart-pumping racing action with 20 cars on a track all targeting the finish line and battling each other as they trade paint and collect intense power-ups, including the ability to blast other cars out of the way with… Expand;58 ;Driving,Racing,Arcade,Arcade,Automobile
HUSTLE KINGS;81;8.1;PlayStation 3;SCEA;VooFoo Studios;Jan 28, 2010;Whether you're into eight-ball, nine-ball or even killer pool, chalk up your cue and step up to the table for a competitive game against a roster of tough challengers. Earn Hustle King credits in Single Player Mode by potting balls, performing trick shots and beating computer-controlled… Expand;15 ;Sports,Miscellaneous,Parlor,Individual,Billiards,Billiards
HOT SHOTS GOLF: OUT OF BOUNDS;81;8.3;PlayStation 3;SCEA;Clap Hanz;Mar 18, 2008;(Also known as "Everybody's Golf 5", "Hot Shots Golf 5", and "Everybody's Golf: World Tour") The fun, addicting and ever-popular Hot Shots Golf franchise, tees it up on the PLAYSTATION 3 system. High Definition) detail of course graphics accompanied with new, more accurate golf physics,… Expand;66 ;Sports,Traditional,Individual,Golf,Arcade,Arcade
CLOSURE;81;7.0;PlayStation 3;Eyebrow Interactive;Eyebrow Interactive;Mar 27, 2012;In the dark and mysterious world of Closure, only what you see exists. Manipulate lights to phase objects in and out of reality in this multiple-award-winning puzzle game. Play as a strange spider-like demon who explores the stories of three human characters through beautiful, eerie… Expand;11 ;Action,Platformer,Platformer,2D,2D
KINGDOM HEARTS HD 2.5 REMIX;81;9.0;PlayStation 3;Square Enix;Square Enix;Dec 2, 2014;KINGDOM HEARTS HD 2.5 ReMIX is an HD remastered compilation of KINGDOM HEARTS II FINAL MIX and KINGDOM HEARTS Birth by Sleep FINAL MIX.;58 ;Role-Playing,Action RPG,Miscellaneous,Compilation
NBA 2K8;81;6.6;PlayStation 3;2K Sports;Visual Concepts;Oct 2, 2007;Sprite Slam Dunk Contest - Live from Las Vegas, 2K is bringing you the Sprite Slam Dunk Contest, hosted by street legend Bobbito Garcia. Choose from hundreds of dunks and a vast array of props as you compete against the NBA's finest dunkers in this 4 player event. The Sprite Slam Dunk… Expand;18 ;Sports,Traditional,Team,Basketball,Sim,Sim
BOMBERMAN ULTRA;81;7.7;PlayStation 3;Hudson Entertainment;Hudson;Jun 11, 2009;[Playstation Network] Bomberman Ultra includes all the classic gameplay elements that have made the series famous over the past few decades. Power-ups are as fun as ever and prove useful in order to dominate your opponents. And of course, the fast and frantic multiplayer action always keeps… Expand;14 ;Miscellaneous,Puzzle,Puzzle,General,Puzzle,General
TOM CLANCY'S RAINBOW SIX VEGAS 2;81;7.9;PlayStation 3;Ubisoft;Ubisoft Montreal;Mar 18, 2008;Tom Clancy's Rainbow Six Vegas 2 is your last chance to rescue America's sexiest city from an escalating terrorist siege that will force you into heart-pounding action from beginning to end. Sin City is back and bigger than before. Explore all new Vegas hot spots as the environment changes… Expand;32 ;Action,Shooter,Shooter,First-Person,Tactical,Modern,Modern
RESIDENT EVIL 5: LOST IN NIGHTMARES;81;7.8;PlayStation 3;Capcom;Capcom;Feb 18, 2010;(Downloadable Content) This is the first installment of new content for RESIDENT EVIL 5. During the main story of RESIDENT EVIL 5, Chris Redfield alludes to a mission where he lost his partner Jill during a conversation with Sheva. Now you can find out what happened during that mission at… Expand;14 ;Action Adventure,Horror,Horror,Survival
FALLOUT: NEW VEGAS - OLD WORLD BLUES;81;7.6;PlayStation 3;Bethesda Softworks;Obsidian Entertainment;Jul 19, 2011;In Old World Blues, releasing in June, you will discover how some of the Mojave’s mutated monsters came to be when you unwittingly become a lab rat in a science experiment gone awry. You’ll need to scour the Pre-War research centers of the Big Empty in search of technology to turn the tables… Expand;10 ;Role-Playing,First-Person,First-Person,Western-Style
FROM DUST;81;7.0;PlayStation 3;Ubisoft;Ubisoft Montpellier;Sep 13, 2011;From Dust is a Modern God Game where Nature is the Star.;11 ;Strategy,Adventure,General,General,General
SHIFT 2: UNLEASHED;81;6.4;PlayStation 3;Electronic Arts;Slightly Mad Studios;Mar 29, 2011;Shift 2 Unleashed combines violence and excitement in this racing experience.;52 ;Driving,Racing,Simulation,GT / Street,GT / Street,Automobile
COLLEGE HOOPS 2K7;81;7.1;PlayStation 3;2K Sports;2K Sports;Mar 13, 2007;With over 325 NCAA Division I schools, College Hoops 2K7 defines the college basketball experience. True College Atmosphere - The most immersive college game yet, College Hoops 2K7 puts the fans in the game and makes them a part of the team. No "I" in Team - Revamped defensive AI and… Expand;9 ;Sports,Traditional,Team,Basketball,Sim,Sim
NBA JAM: ON FIRE EDITION;81;7.3;PlayStation 3;Electronic Arts;EA Sports;Oct 4, 2011;NBA JAM: On Fire Edition will feature exciting new gameplay enhancements, including ground-breaking artificial intelligence that will change the way gamers play NBA JAM.;16 ;Sports,Traditional,Team,Basketball,Arcade,Arcade
ECHOCHROME;81;7.2;PlayStation 3;SCEA;SCE/WWS;May 1, 2008;(Downloadable Game) Featuring an elegant black and white art design inspired by the works of M.C. Escher, echochrome is a puzzle game unlike any other. With gameplay based on optical illusions, players must utilize five simple laws of perspective to join walkways, hide dangers, and create… Expand;32 ;Miscellaneous,Puzzle,Action,Puzzle,General,General
LEGO BATMAN 2: DC SUPER HEROES;81;7.4;PlayStation 3;Warner Bros. Interactive Entertainment;Traveller's Tales;Jun 19, 2012;Lego Batman 2: DC Super Heroes is a sequel to Lego Batman: The Videogame and includes appearances from the likes of Wonder Woman, Superman, and The Green Lantern.;28 ;Action Adventure,Modern,General,Modern
SSX;81;6.8;PlayStation 3;EA Sports;EA Canada;Feb 28, 2012;SSX allows players to experience the franchise’s signature fun and adrenaline-packed gameplay across iconic mountain ranges all over the world. Utilizing NASA topographical satellite data, we’ve mapped out a Massive World for players to explore. Using a Google-Earth inspired interface,… Expand;38 ;Sports,Alternative,Individual,Snowboarding,Snowboarding,Ski / Snowboard
CRYSIS;81;7.0;PlayStation 3;EA Games;Crytek;Oct 4, 2011;In Crysis, gamers will travel to 2019 where a team of US scientists makes a frightening discovery on an island in the South China Sea. All contact with the team is lost when the North Korean Government quickly seals off the area. The United States responds by dispatching an elite team of… Expand;19 ;Action,Shooter,Shooter,First-Person,Sci-Fi,Sci-Fi,Arcade
JAK AND DAXTER COLLECTION;81;8.7;PlayStation 3;SCEA;Mass Media;Feb 7, 2012;The Jak and Daxter Collection includes the dynamic duo's first three adventures: Jak and Daxter: The Precursor Legacy, Jak II and Jak 3.;43 ;Action,Miscellaneous,Platformer,Compilation,Compilation,3D
TERRARIA;81;8.0;PlayStation 3;505 Games;Engine Software;Mar 26, 2013;Terraria? What's that?Terraria is a land of adventure! A land of mystery! A land that's yours to shape, to defend and to enjoy. Your options in Terraria are limitless, are you an action gamer with an itchy trigger finger? A master builder? A collector? An explorer? There's something for… Expand;12 ;Action,Action Adventure,Platformer,Platformer,Sandbox,2D,2D
FALLOUT 3: BROKEN STEEL;81;7.8;PlayStation 3;Bethesda Softworks;Bethesda Game Studios;Sep 24, 2009;(Downloadable Content) Continue your existing Fallout 3 game and finish the fight against the Enclave remnants alongside Liberty Prime. Broken Steel moves the level cap for your character from 20 to 30, allowing you to experience even more of the game, including new perks and achievements.… Expand;7 ;Role-Playing,First-Person,First-Person,General,Western-Style
NBA STREET HOMECOURT;81;6.2;PlayStation 3;EA Sports Big;EA Canada;Mar 6, 2007;The fourth chapter in the multi-platinum selling NBA Street series expands on the fast-paced and larger-than-life 3-on-3 basketball gameplay that has made the franchise a hit. The newest iteration of NBA Street creates a hyper-real world that merges legendary courts with the hometown courts… Expand;31 ;Sports,Traditional,Team,Basketball,Arcade,Arcade
GRAN TURISMO 6;81;8.0;PlayStation 3;SCEA;Polyphony Digital;Dec 6, 2013;Gran Turismo 6 is a comprehensive racing simulator that allows fans to drive a prolific collection of cars on the world's most legendary racetracks.;81 ;Driving,Racing,Simulation,GT / Street,GT / Street,Automobile
TIGER WOODS PGA TOUR 07;81;tbd;PlayStation 3;EA Sports;EA Redwood Shores;Nov 14, 2006;Tiger Woods Comes Alive — See and feel every emotion in complete detail with the introduction of all-new Universal Capture (UCAP) technology. Play Under Pressure — With bigger galleries, mass crowd movement from hole to hole, and cheers from nearby greens, all eyes are on you in tournament… Expand;30 ;Sports,Traditional,Individual,Golf,Sim,Sim
ASSASSIN'S CREED;81;7.3;PlayStation 3;Ubisoft;Ubisoft Montreal;Nov 13, 2007;The first game in the Assassin's Creed franchise is set in 1191 AD, when the Third Crusade was tearing the Holy Land apart. Shrouded in secrecy and feared for their ruthlessness, the Assassins intend to stop the hostilities by suppressing both sides of the conflict. Players, assuming the… Expand;40 ;Action Adventure,Historic,Historic,Open-World
IL-2 STURMOVIK: BIRDS OF PREY;81;7.4;PlayStation 3;1C ;Gaijin Entertainment;Sep 8, 2009;IL-2 Sturmovik: Birds of Prey is based around the large-scale aerial combat and ground military operations of World War II. Players can participate in some of the war's most famous battles piloting fighters, battle planes and heavy bombers across a range of thrilling missions. There are five… Expand;28 ;Simulation,Flight,WWII,WWII,Combat
