PILLARS OF ETERNITY: COMPLETE EDITION;86;7.7;Xbox One;Paradox Interactive ;Obsidian Entertainment;Aug 29, 2017;Pillars of Eternity, the ultimate role-playing experience on PC, comes to Xbox One! Created by and for role-playing fans by Obsidian Entertainment, masters of the RPG genre, Pillars started as a Kickstarter project, where it shattered all funding goals and pulled in more than 75,000 backers.… Expand;11 ;Role-Playing,Western-Style
SHOVEL KNIGHT;86;7.5;Xbox One;Yacht Club Games;Yacht Club Games;Apr 21, 2015;Shovel Knight is a sweeping classic action adventure game with awesome gameplay, memorable characters, and an 8-bit retro aesthetic. It's a hot mashup of new and old! You play as the eponymous Shovel Knight, a small knight with a huge quest. Shovel Knight has come to this land with two… Expand;10 ;Action,Platformer,2D
NBA 2K14;86;5.7;Xbox One;2K Sports;Visual Concepts;Nov 12, 2013;NBA 2K14 promises to raise the bar yet again, providing the best basketball gaming experience for legions of sports fans and gamers around the world.;15 ;Sim,Sports,Traditional,Team,Basketball,Sim
DMC: DEVIL MAY CRY DEFINITIVE EDITION;86;8.0;Xbox One;Capcom;Ninja Theory;Mar 10, 2015;The definitive edition of this action game arrives with enhanced 1080p graphics at 60fps, new features and all the original DLC included. Chain together stylish combos with up to 8 unique weapons. Traverse the demonic world of Limbo as you join Dante and Vergil in the legendary rebirth of… Expand;20 ;Fantasy,Action Adventure,General,Linear
SKY FORCE RELOADED;86;7.0;Xbox One;Infinite Dreams Inc.;Infinite Dreams Inc.;Dec 1, 2017;The best mobile shooter is now ready to rock your iPhone!Sky Force Reloaded is an award winning and highly acclaimed vertical shooter. It features 3d interactive objects, outstanding graphics, special effects, high quality soundtrack and 100% of pure gameplay.Ever wanted to play a good… Expand;10 ;Action,Shooter,Shoot-'Em-Up,Vertical
NBA 2K16;86;6.2;Xbox One;Take-Two Interactive ;Visual Concepts;Sep 25, 2015;Be the Story. The NBA 2K franchise is back with a true-to-life NBA experience in NBA 2K16. Guide your MyPLAYER through the complete NBA journey, take control of an entire NBA franchise, or refine your skills online competing against gamers from around the globe. With animations that provide… Expand;14 ;Action,General,Sports,Team,Basketball,Sim
TITANFALL;86;6.7;Xbox One;Electronic Arts;Respawn Entertainment;Mar 11, 2014;Crafted by one of the co-creators of Call of Duty and other key developers behind the Call of Duty franchise, Titanfall, with its advanced combat techniques, gives you the freedom to fight your way as both elite assault Pilot and fast, heavily armored Titan. The experience combines… Expand;68 ;Shooter,Sci-Fi,Miscellaneous,General,Action,Shooter,First-Person,Sci-Fi,Arcade
DIABLO III: ULTIMATE EVIL EDITION;86;7.8;Xbox One;Blizzard Entertainment;Blizzard Entertainment;Aug 19, 2014;Xbox One players can now experience the full adventure of Blizzard's epic action RPG, Diablo III, and the upcoming expansion, Reaper of Souls all from the comfort of their couch in Diablo III: Ultimate Evil Edition. Take on the role of one of six powerful character class Barbarian, Demon… Expand;18 ;Role-Playing,Action RPG
RESIDENT EVIL 7: BIOHAZARD;86;7.9;Xbox One;Capcom;Capcom;Jan 24, 2017;Fear and isolation seep through the walls of an abandoned southern farmhouse. "7" marks a new beginning for survival horror with the Isolated View of the visceral new first-person perspective. Powered by the RE Engine, horror reaches incredible heights of immersion as players enter a… Expand;19 ;Action Adventure,Survival
DRAGON BALL FIGHTERZ;86;7.8;Xbox One;Bandai Namco Games;Arc System Works;Jan 26, 2018;After the success of the Xenoverse series, its time to introduce a new classic 2D DRAGON BALL fighting game for this generations consoles. DRAGON BALL FighterZ is born from what makes the DRAGON BALL series so loved and famous: endless spectacular fights with its allpowerful fighters.… Expand;24 ;Action,Fighting,2D
DESTINY 2: FORSAKEN;86;5.5;Xbox One;Activision;Bungie Software;Sep 4, 2018;With 2 brand-new destinations to explore, and new weapons, armour and Supers to acquire, Forsaken takes players on an epic journey into the wild frontiers of our solar system where the lines between justice and revenge are blurred. Forsaken also features an all-new competitive and… Expand;16 ;Action,Shooter,First-Person,Arcade
MORTAL KOMBAT 11;86;3.3;Xbox One;Warner Bros. Interactive Entertainment;NetherRealm Studios;Apr 23, 2019;Mortal Kombat is back and better than ever in the next evolution of the iconic franchise. The all new Custom Character Variations give you unprecedented control to customize the fighters and make them your own. The new graphics engine showcasing every skull-shattering, eye-popping moment,… Expand;26 ;Action,Fighting,2D
TOMB RAIDER: DEFINITIVE EDITION;86;7.8;Xbox One;Square Enix;Crystal Dynamics;Jan 28, 2014;Armed with only the raw instincts and physical ability to push beyond the limits of human endurance, Tomb Raider delivers an intense and gritty story into the origins of Lara Croft and her ascent from a frightened young woman to a hardened survivor.;18 ;Modern,Action Adventure,General,Modern,Linear
RISE OF THE TOMB RAIDER;86;8.0;Xbox One;Square Enix;Crystal Dynamics;Nov 10, 2015;Conquer a world strenuously protecting its secrets, endure dangers conditions and unstable landscapes, face viscous wildlife that act as guardians to ancient tombs, and explore massive interactive environments. Utilize the environment to your advantage, climb trees and go underwater to avoid… Expand;102 ;Fantasy,Action Adventure,General,Linear
FORZA HORIZON 2;86;8.3;Xbox One;Microsoft Game Studios;Playground Games;Sep 30, 2014;Race through a wide-open world featuring dramatic weather and day to night cycles. Connect with friends in this celebration of speed, style, and action-packed driving. Explore exotic locations in more than 200 of the world’s greatest cars.;85 ;Driving,Racing,Simulation,GT / Street,Automobile
OBSERVER;86;7.7;Xbox One;Aspyr;Bloober Team;Aug 15, 2017;What would you do if your fears were hacked? The year is 2084. You are Daniel Lazarski, an elite neural detective known as an Observer, whose purpose is to hack and invade suspects’ minds. To gather evidence, you must relive their darkest fears, and, finally, face your own. From Bloober… Expand;8 ;Adventure,3D,First-Person
DYING LIGHT: THE FOLLOWING;86;8.1;Xbox One;Warner Bros. Interactive Entertainment;Techland;Feb 9, 2016;Dying Light: The Following is a significant expansion to Dying Light and the untold chapter of Kyle Crane’s story. Take to a vast new area that will transform your Dying Light experience through new game mechanics, environments and challenges on top of the established core of the game.;7 ;Action Adventure,Survival
DIRT 4;86;6.7;Xbox One;Codemasters ;Codemasters;Jun 6, 2017;Dirt 4 puts you at the wheel of the most powerful machines ever made as you face the toughest roads and circuits on the planet in rally, rallycross, and landrush.;21 ;Racing,Simulation,Automobile
FORZA MOTORSPORT 7;86;6.3;Xbox One;Microsoft Game Studios;Turn 10;Sep 29, 2017;Experience the thrill of motorsport at the limit. Enjoy graphics at 60fps and native 4K resolution in HDR. Collect and race more than 700 cars, including the largest collection of Ferraris, Porsches, and Lamborghinis ever. Challenge yourself across 30 famous destinations and 200 ribbons,… Expand;79 ;Racing,Simulation,Automobile
MORTAL KOMBAT X;86;7.5;Xbox One;Warner Bros. Interactive Entertainment;Warner Bros. Interactive Entertainment;Apr 14, 2015;Mortal Kombat X combines cinematic presentation with all new gameplay to deliver the most brutal Kombat experience ever, offering a new fully-connected experience that launches players into a persistent online contest where every fight matters in a global battle for supremacy. For the first… Expand;21 ;Action,Fighting,2D,3D
DARK SOULS REMASTERED;86;7.7;Xbox One;Namco Bandai Games;From Software;May 25, 2018;Embark upon an epic dark fantasy in a universe stricken by decline and the Curse. Explore its intricate world design - full of hidden passages, dungeons and secrets - and uncover its deeply rooted lore.;9 ;Role-Playing,Action RPG
NHL 20;85;4.1;Xbox One;Electronic Arts;Electronic Arts;Sep 10, 2019;EA SPORTS NHL 20 introduces cutting-edge gameplay innovation to showcase your skills, more customization to unlock your style, and new modes to compete with friends.RPM Tech-powered gameplay introduces Signature Shots that replicate your favourite NHL players' real-world shot styles.… Expand;12 ;Sports,Team,Ice Hockey,Sim
THRONEBREAKER: THE WITCHER TALES;85;7.2;Xbox One;CD Projekt Red Studio;CD Projekt Red Studio;Dec 4, 2018;From the creators of The Witcher 3: Wild Hunt comes a brand new tale set in the brutal and twisted universe of witcher Geralt of Rivia. The world stands on the verge of chaos, as the tensions between the power-hungry Nilfgaardian Empire and proud Northern Realms grow. Facing an imminent… Expand;7 ;Role-Playing,Action RPG,Strategy,Turn-Based,Card Battle
FIREWATCH;85;5.1;Xbox One;Panic Inc.;Campo Santo;Sep 21, 2016;The year is 1989. You are a man named Henry who has retreated from his messy life to work as a fire lookout in the Wyoming wilderness. Perched high atop a mountain, its your job to look for smoke and keep the wilderness safe. An especially hot, dry summer has everyone on edge. Your… Expand;9 ;Adventure,3D,First-Person
GUACAMELEE! 2;85;6.5;Xbox One;DrinkBox Studios;DrinkBox Studios;Jan 18, 2019;Brawling has never been more beautiful! The long-awaited sequel to the smash hit action-platformer is here: Guacamelee! 2 brings luchador Juan Aguacate out of retirement for a stunning new Metroidvania-style adventure, where he must face his greatest challenge yet - one that threatens to… Expand;9 ;Action,Platformer,2D
CALL OF DUTY: BLACK OPS 4;85;4.1;Xbox One;Activision;Treyarch;Oct 12, 2018;Black Ops returns - in your face. Featuring gritty, grounded, fluid Multiplayer combat, a massive Zombies offering with 3 full undead adventures at launch, and Blackout, where the universe of Black Ops comes to life in one huge battle royale experience featuring the largest map in Call of… Expand;19 ;Action,Shooter,First-Person,Tactical
BATMAN: ARKHAM KNIGHT;85;7.1;Xbox One;Warner Bros. Interactive Entertainment;Rocksteady Studios;Jun 23, 2015;Batman confronts the ultimate threat against the city he has been sworn to protect. The Scarecrow returns to congeal an imposing array of super villains, including The Penguin, Two-Face and Harley Quinn, to summarily destroy The Dark Knight. The game introduces Rocksteady's uniquely-designed… Expand;16 ;General,Fantasy,Action Adventure,Open-World
ASSASSIN'S CREED ORIGINS;85;7.6;Xbox One;Ubisoft;Ubisoft;Oct 27, 2017;Set in mysterious Ancient Egypt, Assassin’s Creed Origins is a new beginning. Experience a new way to fight while exploring the Great Pyramids and hidden tombs across the country of Ancient Egypt, and encounter many memorable storylines along your journey. And discover the origin story of… Expand;42 ;Action Adventure,Open-World
DRAGON AGE: INQUISITION;85;7.0;Xbox One;Electronic Arts;BioWare;Nov 18, 2014;Draft and lead a group of characters into rugged battles against a diversity of enemies – from earth-shattering High Dragons to demonic forces from the otherworld of the Fade. Go hand to hand in visceral, heroic combat as your followers fight by your side, or switch to tactical view to… Expand;28 ;General,Role-Playing,General,Action RPG,Western-Style
PLANET COASTER: CONSOLE EDITION;85;7.6;Xbox One;Frontier Developments ;Frontier Developments;Nov 10, 2020;Welcome to a new era in coaster park simulation! Bring your ideas to life with easy-to-use tools, manage all aspects of your expanding empire, and harness the world’s best creations from an endlessly creative community in the Frontier Workshop.;7 ;Strategy,Management,Business / Tycoon
THE OUTER WORLDS;85;8.1;Xbox One;Obsidian Entertainment ;Obsidian Entertainment;Oct 25, 2019;The Outer Worlds is a new single-player first-person sci-fi RPG from Obsidian Entertainment and Private Division. Lost in transit while on a colonist ship bound for the furthest edge of the galaxy, you awake decades later only to find yourself in the midst of a deep conspiracy threatening to… Expand;27 ;Role-Playing,Western-Style
F1 2016;85;7.9;Xbox One;Codemasters;Codemasters;Aug 19, 2016;Includes the full 2016 season calendar of 21 tracks, including the brand new Baku circuit in Azerbaijan, and the full roster of 22 drivers and 11 teams, including the new Haas F1 Team. F1 2016 immerses you in not only the on-track excitement of a FORMULA ONE career, including the inclusion… Expand;14 ;Racing,Simulation,Automobile
